{"format":"keymaster","version":2,"label":"Personal key","publicKeyHex":"0279be667ef9dcbbac55a06295ce870b07029bfcdb2dce28d959f2815b16f81798","keyDerivation":{"algorithm":"pbkdf2-hmac-sha-256","passwordEncoding":"utf-8","iterations":1000,"outputLengthBits":256,"saltB64Url":"AAECAwQFBgcICQoLDA0ODw"},"cipher":{"algorithm":"aes-gcm","keyLengthBits":256,"ivB64Url":"EBESExQVFhcYGRob","tagLengthBits":128,"ciphertextAndTagB64Url":"KbfCVKTCwiQsaWuRpI3MJSmFB5fdkLC5NgJMc4463ZXACLqMii-0PjKoYCSyldOL"}}
