{"format":"keymaster","version":2,"label":"Custom iterations","publicKeyHex":"0279be667ef9dcbbac55a06295ce870b07029bfcdb2dce28d959f2815b16f81798","keyDerivation":{"algorithm":"pbkdf2-hmac-sha-256","passwordEncoding":"utf-8","iterations":1001,"outputLengthBits":256,"saltB64Url":"EBESExQVFhcYGRobHB0eHw"},"cipher":{"algorithm":"aes-gcm","keyLengthBits":256,"ivB64Url":"KCkqKywtLi8wMTIz","tagLengthBits":128,"ciphertextAndTagB64Url":"D3Z1LHIluI511AyMR-ZEEM9f9h1J-J8SqbRuOTo6oQiOn1KhcxyAkcfLiTNYKTSl"}}
